sentence_id	sentence	sentence_domain	source	is_used	clips_count
8b5209dc12ac7d2b361dfb95f14e2d7deeb07391642e8c34d7817989a95b74c1	και όχι γιατί πιστεύουμε ότι θα δείξει κάτι		sentence-collector	1	5
8b61e6c58aa0b0aa06ca8938eb733660730923fbafe9edb7be0ec2241caded82	Πρότεινε κάτι άλλο.		sentence-collector	1	5
8b6374668f18ee63ea5d7fd85306dc54a8fd9482890dcab09ae1cb39892a580d	Τι είναι αυτά μπροστά σε κείνα που τραβώ εγώ, η δύστυχη!		sentence-collector	1	5
8b71f9dec4db4666e2f61453299fbc1933464d08e0ac7cb29f0452a9868d3b0b	γρήγορα θα μάθετε περισσότερα και από μένα.		sentence-collector	1	5
8ba3c745a30ee6b09d187ebd9edd5b73f637e3a17584c120208515a7000496b6	Τρελάθηκα εγώ;		sentence-collector	1	5
8bbbb039e5193f23149c89f09a7ced98c4fec6a78b636f9eedc1f16f068c8881	Μη μου τις θυμίζεις πια!		sentence-collector	1	5
8bc6d53ece48fe3d295da83b74dc25ba12c200a9ee652373ceb74ba33ac30b33	Η Ειρηνούλα λοιπόν έβγαλε τις βελόνες της και την κλωστή		sentence-collector	1	5
8bc81b650c1153c907bb2439c103e6c4cfc5c83f01c25feea7b99e9927030605	Την ίδια ώρα, σύννεφο σαΐτες πέταξαν από το δάσος		sentence-collector	1	5
8bd33556cfd604f8fb863c4d534b2da54ceb5e80c3706300f5799ed55b17a788	Σε αντρειωμένα χέρια, κάθε σίδερο γίνεται όπλο!		sentence-collector	1	5
8bd4a9c17391d36cf8c070555b83899800b76f0a5a089e751e9e2b453509c3f1	δεν ήξερε αν έπρεπε να καταφρονήσει την αδελφή της.		sentence-collector	1	5
8bd5ffda56d2096cd434675dd5e15f79545fd30b5c951dbf065fee5910187e80	και αρπάζοντας το κοντάρι του το έμπηξε με ορμή στον πάτο.		sentence-collector	1	5
8bddcfd69d3042b0d2b691ed443ee31e887957c66512c8157c736106651b35a4	ουτ' εγώ δεν ξέρω πια πώς τον λένε.		sentence-collector	1	5
8bdfc191e5fbcf17c9e682cad52e12ea322c1296ca3f4467d78db32f4afb81a0	μαζεύοντας πάλι το κοντάρι του.		sentence-collector	1	5
8bf455c438061601f47b23ba38530388ff2de81f166e5b65fc4c018d2f0da3c4	Όλα ήξεραν.		sentence-collector	1	5
8bfbc0a2e343c6ed7f7d65da30c6964b9913e9e1cd38f46ce083e9db675b270b	Το ξέρω, αποκρίθηκε ήσυχα ο Πολύδωρος.		sentence-collector	1	5
8c1e37b80b34cd63a048196fa18fe9c380c371aa1b69743978441fffc9f51391	Ξέχασε το άτομο σου και το συμφέρον σου		sentence-collector	1	5
8c1f9deb068ddcba09b7e797d5db4b36ae379f47c5f3946e050b40b1c3f826ab	Το Βασιλόπουλο όρμησε μπροστά στον πατέρα του		sentence-collector	1	5
8c276975575846ab395b04b3b8d4fc1f889c87d8c57401e93aec6244b9f3d8d5	που ήταν πάντα χαμογελαστή μαζί του		sentence-collector	1	5
8c2aa3e834ca8d80ae8b1e7425610ebf2da835e9a459042f5ef5b31073bc0f69	Τον έπαιρνε τότε ο ύπνος		sentence-collector	1	5
8c43b8bc214d98d839df49c0a4de02f5d5aa597583eba3625c8c084cc050c5c4	είπε ο άνθρωπος, με αλεπουδίσιο χαμόγελο.		sentence-collector	1	5
8c71aec05c20f16de04197c5b2599fc838eaec6ac5569b1d329d829175569050	Δεν θα ήθελα να μπλεχτώ στη διαμάχη σας.		sentence-collector	1	5
8c72c0dae4876b51280572d5ba8235a1ea5c9c925a3ba30d0e6de4e0dd460539	το νέο Αστόχαστο		sentence-collector	1	5
8c809c36a797eb41e6bdd90a41b8f177eb8412fa08d87a6a8a3b6d53b2dc70bd	Πες μου, σαν τι λοιπόν είναι το παλάτι του;		sentence-collector	1	5
8c9cd8870ce064a0181b91d860f52c5202b0d1462aeda79c8f64b12da4f99f92	Όλο το χωριό		sentence-collector	1	5
8ca374d3b8353fe46be5fcae432bc236f80d0ef65726237c752d2a368e289c99	Τι μας δέσατε τα χέρια σαν κακούργους		sentence-collector	1	5
8cacde71f294587d2bd797f06e004d1b13a61b6683f5ea48dd1d0f07c0119214	γιατί δεν ξέρω γράμματα!		sentence-collector	1	5
8cb10c00c82f6e2ade95e78d0d42f90ec77aebbd21876e6f27c6d7bfc62d26d9	Θυμούμαι να είδα τέτοιους στα νιάτα μου.		sentence-collector	1	5
8cb7e8a072c6fcbc96a9e27a03ae96109f28f3d8ca61fc0764d289cdf383fb39	αλλά μετά κατάλαβε πόσο ηλίθια ήταν η σκέψη του και άρχισε να τρέχει		sentence-collector	1	5
8cc7983a526b12d1c4183d70303c06bcd772a83ad3624cd1a49d7b0699a43116	Και ξεκίνησε με την κόρη του Κακομοιρίδη.		sentence-collector	1	5
8cd157733aa122bb9f1cc2abad9d7889c79d1e32d81503fdae62548c1c31498e	Ο θείος σου δουλεύει το ξύλο;		sentence-collector	1	5
8cd5c5707b41794bf509a96e64e7ddd60c9e524ae60d5e8faa9500de592da229	Άνοιξε! φώναξε το Βασιλόπουλο.		sentence-collector	1	5
8ce915f56a1bf55db5bc64d599b7fe8d7d76d21d322fa5318974e83b8c2fc389	Θα τον ρωτήσω και αυτόν ύστερα.		sentence-collector	1	5
8cf47d8b9c9b22f280f4acfee1aa6ab7dec2120d9f3ee3da12e038b2cfb77b2e	είπε με δύναμη		sentence-collector	1	5
8d10096a53942adff3ca8267b8e72ba6590b1479ab355d75b8377d0b04495662	Είχε αμέσως δει ότι ήταν αυτός.		sentence-collector	1	5
8d26031077e5e7c52d8a6116c329e33a77f53b7aefa846620eaf22327d3625c3	Το πληγωμένο παλικάρι βρέθηκε μέσα στις φελούκες του, μα ο ναύτης δε βρέθηκε.		sentence-collector	1	5
8d304b002243c75741f7549752aa986dbe6c16045f6ec1fe346303f2645b9c09	πως ετούτο μας εξηγεί γιατί βρήκαμε την εξώπορτα ανοιχτή		sentence-collector	1	5
8d3547e0603a4530fb1171d40d2ab1c1acf034929bdb9f5794207bfeedeb8579	από κείνους που περιφρονείς.		sentence-collector	1	5
8d395a3e168b7cbf84ff86691beda25edca39c0fe3049e83e3d979a30575cef3	Την έπιασαν τα νεύρα της και βγήκε από το δωμάτιο.		sentence-collector	1	5
8d3b5c1c4820c30fe4becdc6c9074cc97a21b53b9d3371e029f9226c5843f31b	μαζί με μεταχειρισμένα ποτήρια.		sentence-collector	1	5
8d47ba718ff61fb368cfc783b3a0fa335320ddaf7293fa52d16211bcf5003880	Τι διασκεδαστικό που είναι! είπε μ' ενθουσιασμό.		sentence-collector	1	5
8d4989aed8073289239823d01583cbc2f676329f55071c28a0d0f469379c3326	Πώς μπορώ να τον συλλάβω;		sentence-collector	1	5
8d4c675afd33a72b85ffe4ba5343d2fce1737b500512705ad0d92413d2c47118	Δεν έχει εδώ στρατηγό, Αφέντη		sentence-collector	1	5
8d52c95b866492d8ea064466637eb238cee86cf71864719a4568b98b9f470f2a	Πού πάμε; ρώτησε.		sentence-collector	1	5
8d5d5d48bce97868558476f0bfd0401fc3d4ed8c96c80590fddbcc581839c096	Μας προτείνεις δηλαδή να γίνουμε στρατιώτες		sentence-collector	1	5
8d5d940275adece2805c45485e3266c3d68777493a2883680ebae7d6dd435f3b	και αναστέναξε με ανακούφιση.		sentence-collector	1	5
8d6b4b2f5e054b7f5df3b689c5bb584228c79bac05fcdaa7e6c13b653ead2bb2	Έκοβαν τα δέντρα		sentence-collector	1	5
8d7b9c6155066272f22e0c0690524f32f0cdc40e4ecfe0183c873083b71b18f1	όσο γρήγορα μπορούσαν να τον πάνε τα στραβά του ποδαράκια.		sentence-collector	1	5
8d7fc861547f812ac06ea6e0bc1db09fbc18873b0365f9d745c374baf96b188c	Συγνώμη αλλά αυτό δεν είναι σωστό.		sentence-collector	1	5
8d9e6cc6e68c7d53f4099e638071b913adaa04c5c18e038ad56a0cb6edc94ebb	Η Ειρηνούλα σηκώθηκε και τον ακολούθησε.		sentence-collector	1	5
8db07e8f6d6a9a420d2e0ee9b9a746c84d9cab23bc5773811d7763842fc0fab6	και τα μάτια του πεταμένα έξω από το κεφάλι του.		sentence-collector	1	5
8db2f4a7ac9215953ba9ae3bce0061be06115ca4849f5c7ea4091c4b01721a06	Αφέντη, όταν άκουσε ο Άρχοντας θείος σου		sentence-collector	1	5
8dc5120175a9e8dc7b925b92d6ae5cacf54a6f880a44f05d0681a44723051ecc	Ποτέ δεν είχε καταφέρει να εξηγήσει		sentence-collector	1	5
8dd8219b41a110c18a6c9b897198aa27057b7076fe138a383c8b8c6d9672bcd9	Για πού;		sentence-collector	1	5
8ddfe8c44ac442483df336a8755caca4e0d7a287a84ef42779ba8e32a475d2b4	Και πώς έτυχε να δουλεύετε μαζί του;		sentence-collector	1	5
8de0cf63c630f1b324cfd8ada07c8ddceb67e30351c90fdcda89f7750e14ba80	χαίρονταν την πρωινή λιακάδα, ανασηκώθηκε.		sentence-collector	1	5
8de14563c2466c7622ccf9eb11d2975f743cca3d4a89617f9620e60c617e290c	Δεν κοιμάται δηλαδή, μα το ίδιο κάνει		sentence-collector	1	5
8de3ea950d4e37a86c499112d0771b7ded6528779d59067a712ede9aff34a21b	και πήγε στα ξένα		sentence-collector	1	5
8de947b3f1008addc655c47c00f8d01c8b6f9955e2852ed3d11acfffd52f65bc	να δοκιμάσεις τι λογής τσιμπούν οι λόγχες		sentence-collector	1	5
8df1ae9063b2f6cb075ea304a6a88d36d3da6a8a058698646d7f091ef8d91708	Πώς ήθελα να ζήσω να το ιδώ!		sentence-collector	1	5
8df674ad26ec18a395eda22ee4db53bfbb4860c9d822d17c6e744bad7c349585	και τον φίλησε σφιχτά.		sentence-collector	1	5
8e0734fbc005e7c5c7852f313005811c390ef0e9ab7e1fcf22edbde6c75e4134	Και η λεύκα μουρμούρισε		sentence-collector	1	5
8e183d73d2518f2b800d2e5bc0cc95cd6c9316e0e4d5bd4bff89e66171fe0da9	Στην πόρτα απ' έξω, πεσμένο στα χώματα		sentence-collector	1	5
8e1a6ea01e465db5c2bd7b9714a04f9d28daffbb021b544a3971bc7394ef8a0f	και ήλθα να σε βρω.		sentence-collector	1	5
8e1e0926aeeec019ddb39768d04f23e809ef3240936701793a59855f2031df6a	Πάρε μαζί σου την ζακέτα σου, θα κάνει κρύο το βράδυ.		sentence-collector	1	5
8e3978f3ab80174f11690f414e49d964240bc7b3ac0e5039535da7edef521499	Θέλησε να την αποχαιρετήσει, μα η κόρη τον εσταμάτησε.		sentence-collector	1	5
8e3b5a1bdd8169771e453d86473db5ec805d15fe48ca3dce0bddbbac2b075675	Πήρε τον καφέ και κατευθύνθηκε σε ένα τραπέζι στη γωνία		sentence-collector	1	5
8e510ef4f9ed02080577d456103167dbe2e743c23f8fd7b7d568efae71b3423e	τα έκρυψε στην τσέπη της.		sentence-collector	1	5
8e5862656103897573c83ad97fa34afa3618591aec588871bc3ee86ceea63b82	Το Βασιλόπουλο έσκυψε και τον φίλησε.		sentence-collector	1	5
8e673b52e46679ea1b89d63a3bd653799663399a81ddd600cced32f7ad8c586f	πήγαν πάλι στο δάσος		sentence-collector	1	5
8e6ecf6eb9f3334baae561820a738520561f9bcfb49f679419950fc083953e69	Και δεν τους γράφετε να ξαναγυρίσουν;		sentence-collector	1	5
8e7fe941f238dc9b911c1c94a3f72f28dfd9842aa3fa56c239948e646ea66c1a	Η Αφεντιά του θα τον δικάσει.		sentence-collector	1	5
8e89a807b0d7aae8788cb39b95907babc94e12ffff291a5c20ce79de4d7dc2bb	Τα πλήρωσα, Αφέντη μου		sentence-collector	1	5
8e901c687585122bb5ac63d479e61e3945b83d4088a3797d0754eda0214a9bae	Τον αυθάδη!		sentence-collector	1	5
8eb271db3b1962802508a4761287799b68e2a4a7cde506cef0e9b136bf110ef3	Μα είναι κακό το μέρος, πώς θα πας εκεί;		sentence-collector	1	5
8eb56826b57ccb305a0ba9c8cc8c543174e920b27d47e2d2821fd2362268c353	Άνοιξε! πρόσταξε το Βασιλόπουλο.		sentence-collector	1	5
8ec442b0719d3bc57d32fe0564571cc2fed9d308418c1c4f4a39a8fe7d52ea81	Μπορείς να με βοηθήσεις;		sentence-collector	1	5
8ed190e5f6ec899fc8cf4260d09ad9c958f2d0320a4eded6568deaeab48bce19	Ας βγει το Βασιλόπουλο, είπε ο νέος με τα αναμμένα μάτια		sentence-collector	1	5
8eee60cdbd3493a8a54b289669f182afbc7d934eff16916dfe5ac6fa09df3fa6	Και όταν θελήσεις, έλα πάλι να μας βρεις.		sentence-collector	1	5
8ef2a52f16a7badad9011be359d059ba1129299c7a0a2715b82f5fe19d3b56a1	Κλείσε την πόρτα σου κι έλα δω.		sentence-collector	1	5
8ef5b61259777b9ddf8445f4ad48beec68506b7381d4a3816eadc2eaccc524b9	Δε θες να σταθείς ακόμα λίγο; ρώτησε.		sentence-collector	1	5
8f0cf63fef19b47e25cf1849b5c84a00407d9bac77c0722aede5aedd18f812c8	και πήρα τ' ωρολόγι και δυο ασημένια τάλιρα.		sentence-collector	1	5
8f1639a2eb17f06db3c18b6d6685e791b6f1ad3c27cf49c1f2503bae7b22eb6c	άρχισε να συμπεριφέρεται όπως η θανούσα πρώτη.		sentence-collector	1	5
8f42cfafeba6a57ec76e694da8639ad6673f5303a75c3798603fc573fd3e322d	Έχει γκρεμούς αδιάβατους κι αιώνια χιόνια, αποκρίθηκε ο κουλός.		sentence-collector	1	5
8f54b82b28c5dc979b0dad87a5ed28fb5108cba31c43e8132a4bedb7a1863713	Σα δεν έχουν όπλα, φώναξε με αγανάκτηση		sentence-collector	1	5
8f5c0e38c30e8ca9b2c083f9d3b49ca526700a37cf45d3018c9958f320876a13	Ο λαός σου είναι σαν όλους τους λαούς		sentence-collector	1	5
8f5f8c50513d23eb6556b7a2adcb5a7f54e0fc31b3c7dbf689e6e10aa031916c	Το λουρί λύθηκε και χρυσά φλουριά χύθηκαν στο χώμα.		sentence-collector	1	5
8f7835f92171d3f1986106fa398dcc721eab7cd43124e6b72ed09ce66f251d72	παρέχοντας παράλληλα τη δυνατότητα στους μαθητές την ευκαιρία		sentence-collector	1	5
8f7a2292922849a693ccf14b5ed6bc28f3df48276843b0f0ef97cd2539e789b0	Κηρύσσουμε ως αναδασωτέα δημόσια έκταση δασικού χαρακτήρα		sentence-collector	1	5
8f9358a8bb95a4fa360037c5574e39b8ab6143494e08cddd33bda56f66d8c877	Και το νυχτερινό αεράκι χάιδευε το μέτωπο του		sentence-collector	1	5
8f9923854de19af73c766f43ee60742941ffb453bdd15ffe7b252722648198e5	Δεν ξέρω, Αφέντη, ποτέ μου δεν ήλθα τόσο μακριά		sentence-collector	1	5
8fa05e640366508cb4a837456957abf4a54396378dc59f74f5c9c18de539fc63	Και γονατίζοντας πλάγι στο πανέρι, χώθηκε ο μισός μέσα.		sentence-collector	1	5
8fbc587eabc4f3c701f7073ac173f7fbb8f689530189d015e0663106aa8674ae	Με το καμτσίκι οδηγούσε τον κυρ-Λαγόκαρδο		sentence-collector	1	5
8fc02afe394274c1c83177e95702ddd45df16601e0a00445e308249e339d2d04	συνολικού εμβαδού εξακοσίων οκτώ κόμμα είκοσι τριών τετραγωνικών μέτρων		sentence-collector	1	5
8fc557ba47ceb2e48e513c4b5e8273d4681b70acc1a9fca5590a60aab7b81d2a	Πάρε ένα καλαθάκι μαζί σου, θα μαζέψομε ό,τι βρούμε.		sentence-collector	1	5
8fe187ccf3741b998afb34a0dfd5b9fd574133ede4acfc658d11eaaa4adb6350	Χρειάζεται δυο μέρες να πάγει και άλλες τόσες να γυρίσει.		sentence-collector	1	5
8fe9971e390772fa2af0b5f262b73b3ce643f3681795efb374ee94999af4770e	που είχε βρει στη μπαλάσκα του Κουκουβάγια		sentence-collector	1	5
8fef6938d1829e117d75f18209b336d8439443b9b7842cca1497b272c559b13a	Καθήστε, αρχοντόπουλά μου.		sentence-collector	1	5
8ff6799e637d170be2529434af2cf580bc9a39761e6e9d0d637eda8b95eb92f5	Και οι τρεις άντρες μαζί		sentence-collector	1	5
900518a7a7546eb6a500e57085164489e55dee60892ccb8d203dd968a763e364	Όλοι εδώ είμαστε, Αφέντη!		sentence-collector	1	5
9033d5d7613c993257744a2f9418ff2266fb065133ba416e13b4e0e77ffbd0da	έμοιαζε να τους κοροϊδεύει.		sentence-collector	1	5
903470c54fc234fa5f8c201b73180288376672569923de36340ae8aecd06f4fd	Ζήτησε να συμμαζέψει τους στρατιώτες του, μα κανέναν πια δε βρήκε.		sentence-collector	1	5
9035954102ed3eddecf9dd3f952176725de4f6b8b2dbdaa7601480d49a3d9ec9	Αν έλθεις νωρίς θα με βρεις εκεί.		sentence-collector	1	5
905d4724bafe1daade7f68ac1e014a5e655fed56a27d60071d29a45691ddd8f6	Και τώρα θα έχει φθάσει ο Λαγόκαρδος στο βασίλειο του θείου Βασιλιά		sentence-collector	1	5
906f5d23bfabbe15fb4db1f20172c358d589e36e0a23aec9c6992ab69a5b57a9	Πάμε να βρούμε δουλειά, είπε το Βασιλόπουλο.		sentence-collector	1	5
9070e98874e4a3b5ede70dc1931cea484f59414d8e15da8515eb433c848c59d6	Δεν πειράζει, σου δίνω το δίπλωμά του.		sentence-collector	1	5
9071c91b179f168d85bb30ebae6620accacaf1cef8a9208319b2e169f66e1d91	Λοιπόν φώναξε το σωματάρχη!		sentence-collector	1	5
90775af69687ea15155d3434025784f7e6df5a67aec0845f43606c6bc215e4f8	Μα και αν σε ακολουθούσαν		sentence-collector	1	5
908c974053615fba09b65be11f41d632d4699adfb3dae5fbc3484bc60cbb503d	Τι εννοείς; ρώτησε.		sentence-collector	1	5
90979ab5a188158bdbbc554cb4a31a5747dc7dd936d7d384738d4698fd5d1d44	Μα είναι αμαρτία!		sentence-collector	1	5
90994c94c25b3a49473d6eb9123b4e2e96bc491fea1d8448e33597fc5900d6cb	να ξαναφτιάξεις το έθνος σου.		sentence-collector	1	5
909b78b4533ab56ffbeb173ee96172d4b2b46118bf828dfa1e3c27ac8ac2d149	φάνηκε στην επιφάνεια του νερού.		sentence-collector	1	5
90a6a70cbc8af252e3d179123c4aba2e37257a8cf6ac29fbe4ac16a199f7dd9e	Παρατάτε τα καράβια όλοι σας!		sentence-collector	1	5
90ab3f9d1ccc3b400c3227404d4e367a1be456f8b4889978903044b2d3540ea4	όταν την είδε να τα πλένει και να τα σκουπίζει.		sentence-collector	1	5
90d2c2ebb7f41b33458f00ee435df00646f4579808975f0773a253d2f061801d	κι έτρεξε στη χώρα, στο σπίτι του κυρ-Λαγόκαρδου.		sentence-collector	1	5
90d910264eb642b61947c1408a93c86f14c1ceaa3368cbe50c58e632f3aa27c2	Περπατά μπροστά μου, πρόσταξε με θυμό.		sentence-collector	1	5
90df58b1446e57c4607ad7849090caedd72cb5f4f5701ae1fa9cd1901a96e19a	και μου περίγραψε τον παλατιανό που τον γκρέμισε		sentence-collector	1	5
90fec5eb7f163bd3dad6993daec5057c7c7a97fa7eda40c96ea4a0f79e0b3442	Τον έπιασε τρόμος, γύρισε πίσω τρεχάτος, ανέβηκε στο βουνό.		sentence-collector	1	5
9100f88de634ead774bf35df7656ebeac1aced0209f30456c45a5a9ccc599593	Έξαφνα ένα χέρι έπιασε το δικό της και μια λυπημένη φωνή μουρμούρισε		sentence-collector	1	5
9113df128c88acba617eef459e6b5df271140938a135b78685a962cce13dc77a	άλλοι πήγαν στη χώρα να γίνουν, λέει, επιστήμονες		sentence-collector	1	5
911c0210a624afd79ed5f6dfb7c274290375422ef9aac2411d8706fe7f6778c0	Βέβαια μάλλον θα χτυπούσε ο συναγερμός		sentence-collector	1	5
9123cf12abcd5f75e145ab5ea1db8f23c94382ee58d67ebe196bb1868967b908	Τι κάθεστε άεργες και μένετε στα σπίτια σας;		sentence-collector	1	5
912dec09b41419a392426fc9f0c8fe92bcf922d6c5e42ebc38459a792f894841	Ήσυχα, μα αποφασιστικά		sentence-collector	1	5
914131d1bf5e7c62ddef8d6d3a4680abecf4f3e25eff27de16b64024d39b9e9a	Προσοχή! είπε ο Βασιλιάς.		sentence-collector	1	5
91456027aab53a731790c8ac3b1d07fb92ea91fa7941080b6c3b9b3451927c7f	Διάταξε αμέσως να πάγει κάποιος να φωνάξει.		sentence-collector	1	5
91686207673504dac22c5a9fd79b194a1da7483a260ea30f1ed0a53d321815df	Ο δυστυχισμένος Πανουργάκος ταράχτηκε πολύ.		sentence-collector	1	5
916a8b919439f8fb1131eaa652d98e3e7f72e64430d4ecedae46337a782f68f1	και ζουν στην καμπούρα του ενός και του άλλου.		sentence-collector	1	5
916e115ffc593b76a27ea128dff9a5ea3b3f538ce1f0814f27fceb38723484b5	Κοιμήθηκαν αμέσως		sentence-collector	1	5
9174289d04fb53f5de2996f65a6546219d258005c4a2b0b08bd26ffe1925af75	Μαζί να κυβερνήσετε το Κράτος.		sentence-collector	1	5
9179dcc9e9aac75f850b13d138e3c3512582ca52404dc4ff27039834c051d3f0	είπε θυμωμένα το Βασιλόπουλο.		sentence-collector	1	5
917a8b83884d0e755a4f1d68e4e00f7b3671d21c9b10a3c703839058d976cdb8	Λες και το έριξε δω επίτηδες		sentence-collector	1	5
917ef02bf268c43da51e39af76ab2ecf7ea058d8528e42cfa909992d415f5aa2	ας φροντίσουν για τον εαυτό τους.		sentence-collector	1	5
91b718c46998e50714cd01162368dbe86475516bab89c6a232044dc51d1bf3b5	υφασμένο με σχέδια χρυσά και ασημένια.		sentence-collector	1	5
91d85d7f57216262291d82c030b41f3281fa89c101f01a9b4da5362f6b59fdfb	Κατέβηκαν στη χώρα και πήγαν ίσια στο σπίτι του αρχικαγκελάριου.		sentence-collector	1	5
91dcc6baea309ed6f47e145c01d3970afc91e7a49859ce073e5c14c6f464fcbe	Το θέλει ο παραφέντης.		sentence-collector	1	5
91e6db6850f228ec9dc6cbedaa5d1428ab36067458e057ec631a1c77968b18bd	Αχ, Πολύκαρπε!		sentence-collector	1	5
91e7f851f8ace600f2c9bb5051b25cda8d7c03b361c9cc443efdf50a7c8563d6	Έβρε το και φέρ' το.		sentence-collector	1	5
91efdcd2e7e975e50fc1973f2afa4e3bf29d46de3ea0bf56f959a0233d876c7b	Και τώρα τι θα γίνει με το σκυλάκι;		sentence-collector	1	5
91f6a0443ecdfba4402737850ea773c4d55661f1166cb2f8ca54ea2f808a5ed1	γιατί θα τον έβλεπε, λέει, γρήγορα.		sentence-collector	1	5
91f6a83a29eb93641c9ccd160eea9433f085ff81ffa73e75aa7b1939d5a46790	διέκοψε το Βασιλόπουλο.		sentence-collector	1	5
91f7e8bf5ff1c4ad4bef34e789dbfa48b607c8b448ab7d02f6e8edac952c1955	καθήστε να ξεκουραστείτε.		sentence-collector	1	5
920010488fbce5529d6fab859e8dfde861f5c650a760db29d0887b9e358c40bb	Την αγαπάω όσο δεν πάει!		sentence-collector	1	5
9210134ac54e5eb367e92fd2bea63d78ef4135de6a0d4a75b9d552c0667f8319	Γενικό γέλιο του αποκρίθηκε.		sentence-collector	1	5
9232bdcbfc712e21b798d822cf960aca4b592a5eb30477509e14cd0b0e27daaf	Πάρε τ' άρματα σου και ακολούθα με!		sentence-collector	1	5
92374cb00655852f4fe1c2e5586368cca61a72edd5f7285a0b4a78d040380baa	και ξαπλώθηκε στο γρασίδι να ξελαχανιάσει.		sentence-collector	1	5
924f73f88e942111bc32fe47ee1781a11877660bfdb4025b10d5ab645ebcc1d6	Σε περίμενα, του είπε, έλα να βγούμε.		sentence-collector	1	5
92638632edf26eb2be46a7347c7558a5d6444ec62074509f6cea224d1cd90673	Ζήτω!		sentence-collector	1	5
9266f5ffa44881822aa87cfbc26184d884d6e97fb408ae96f3d2b617b6dd6e81	Τι περίεργη μέρα		sentence-collector	1	5
9280460bcf4ee453b9f01b6a73aa06fadfa2261fb56236705a263f81644ac3d5	και ο Πολύκαρπος ξέπλενε τα χόρτα.		sentence-collector	1	5
928f14bbbf5db0a501177a7da2f9a4933fa1030f0c56bb62c854ba00947c6d5d	Πάρε αυτό, είπε, και δώσε το στον Άρχοντά σου.		sentence-collector	1	5
929221c52ec10b593bd91a1ee5042686e8afdf541d54b50d79c2d6ab242b2c08	Ποιο; ρώτησε ο υπασπιστής.		sentence-collector	1	5
9296e3c1557d8c552812dd130a3a4df8be6cbc4123a91027645cf00adb8211e5	Αγκάλιασε την κοιμισμένη κοπέλα που άρχιζε να αργοσαλεύει δίπλα του		sentence-collector	1	5
929badcb6aa56428b0aa209ebfa1ed8d9301d934e328e75e92d4f59bdcaeb05b	Με ακούς λοιπόν;		sentence-collector	1	5
92a14e43bd966b96ec88e60a41b0e89c492dfa187d63679ed72c8327df4de877	Το Βασιλόπουλο κατάλαβε αμέσως πόσο μπορούσε να ωφεληθεί από αυτή την αμέλεια.		sentence-collector	1	5
92aae0e345a205c019865305b30ade3a4efb6b808f99dc9df749172134a6a154	για να του πάρει το πουγγί		sentence-collector	1	5
92adf04e9e301915fb7ad29386069a61eafd0868de486526fb9bed79ddcd15fe	θα τους αναπληρώσω εγώ.		sentence-collector	1	5
92aedb842468c8116120b602b0466d35071f266da606be30f0ad57eddba26cc9	Μα το Βασιλόπουλο τον είδε.		sentence-collector	1	5
92b104cf26bbc3f87f2f42edf8df2c085d00e46f02ce72a1ed7dd84981840e81	Γύρισε και κοίταξε τον αδελφό της.		sentence-collector	1	5
92b60d94ffbac562af839b8c05309cfe5eca44abba6b2158ade5fca17f99b207	Η πενηνταπεντάρα γραμματέας σηκώνει στιγμιαία το βλέμμα		sentence-collector	1	5
92d4feefea8deea82c0b5acafa8589b7b4e2a04351b3eb1a5402cfda6062108e	και βουτώντας το στο νερό ως τον πάτο		sentence-collector	1	5
92e9610b878f810204fe1bd2f742efe49eab7b4bff458200e9699b14e529eb5a	η νίκη είναι δική μας.		sentence-collector	1	5
92ed548c44b4c8c9c30106e4c45f2472743d6cdd99d78b29c5082e8a14c14593	θα ερχόμουν αμέσως στο σπίτι του Πανουργάκου		sentence-collector	1	5
92f62936fb4afb3a5b87ea19673e75ba4eb2ab9a5f1ba143de67302199ff4916	Τι δε μας κάνουν ρώτα, παιδούλα μου!		sentence-collector	1	5
92f92410ddad1342ad1ee133c32ec3a1c65455a1deb263869a5542a6098106e4	που είχε κάθε φορά που έβλεπε στον ποταμό κανένα καινούριο καράβι		sentence-collector	1	5
93125d831f8b2ad9b9e2de4b4c56b1f1d7bf55eb2094579038242aa9c0f1e0d5	όπου Βασιλιάς και Βασιλόπουλο συζητούσαν ακόμα		sentence-collector	1	5
