sentence_id	sentence	sentence_domain	source	is_used	clips_count
001351720bffec0e1de6faee13ab4ae092bdaa5d299db741472b68bca48dc4c1	Η Ματμαζέλ γρίνιαζε πως δεν πρόσεχαν στο μάθημα		https://www.openbook.gr/magkas/ public domain book / ?? ???? ??? ????????? ????? ??????? ??? ????? ?????, ????? ????? ???????? 70 ??? ??? ??? ?????? ???	1	0
00c551748dd05cf31d79c4b28e4148ff0e337f34a1b6b9406d9a9dec21a27490	Και προπαντός, μην σκεφθείτε ποτέ πως ο μύθος είναι κανένα απολιθωμένο παραμύθι.		https://www.openbook.gr/oi-mythoi-mesa-mas/	1	0
011c15d92a4739ecb0c2689447e242ab990e14e5556b57624cd73a3690703a39	είπα θυμωμένος		https://www.openbook.gr/magkas/ public domain book / ?? ???? ??? ????????? ????? ??????? ??? ????? ?????, ????? ????? ???????? 70 ??? ??? ??? ?????? ???	1	0
019f0e51a79133773bc6ee3ec3f82d021c108bf0aa09efdb7fae295665fdc31d	Και μας ξανασφύριξε.		https://www.openbook.gr/magkas/ public domain book / ?? ???? ??? ????????? ????? ??????? ??? ????? ?????, ????? ????? ???????? 70 ??? ??? ??? ?????? ???	1	0
01fb1e9782eeb68a5effc224be67af34d29c919e4ff8b239068cc216b9857cac	Τι τράβηξαν τότε αυτοί οι πρώτοι μάρτυρες!		sentence-collector	1	0
02002e5b6860b34292440d949fd82d2fd721bc82bcbe839c16b073d984001641	Αυτός έβγαλε το κοριτσάκι από τη θάλασσα.		https://www.openbook.gr/magkas/ public domain book / ?? ???? ??? ????????? ????? ??????? ??? ????? ?????, ????? ????? ???????? 70 ??? ??? ??? ?????? ???	1	0
02117eca884cf0b9966f8cf852af84ea946223aca9f3a4b64ac6a2f8bd8240f3	Το βρήκε ο Μάγκας!		https://www.openbook.gr/magkas/ public domain book / ?? ???? ??? ????????? ????? ??????? ??? ????? ?????, ????? ????? ???????? 70 ??? ??? ??? ?????? ???	1	0
02795349e95dee5dfb22c225bdeea7e7aef328f822fbed92274992888dc48e25	Γιατί να τη σκοτώσω;		https://www.openbook.gr/magkas/ public domain book / ?? ???? ??? ????????? ????? ??????? ??? ????? ?????, ????? ????? ???????? 70 ??? ??? ??? ?????? ???	1	0
02942530be062ec3e3d2daa192313de55f0f62b478dfa3f39ef2dbefcce64ea0	Δες, Πατέρα, έχει ένα σκοινί στο λαιμό, είπε ο Λουκάς.		https://www.openbook.gr/magkas/ public domain book / ?? ???? ??? ????????? ????? ??????? ??? ????? ?????, ????? ????? ???????? 70 ??? ??? ??? ?????? ???	1	0
02ad519bd17795f89f7bd020444cd79373cb7572d247241ccb00717d2fb9c669	Το παιδί είναι άρρωστο.		https://www.openbook.gr/magkas/ public domain book / ?? ???? ??? ????????? ????? ??????? ??? ????? ?????, ????? ????? ???????? 70 ??? ??? ??? ?????? ???	1	0
03287a71576ec7438a5b7df7e3e51036235866e31d22fdaa07e17905bf331d55	ώστε να δικαιολογείται η ερμηνεία των μύθων		https://www.openbook.gr/oi-mythoi-mesa-mas/	1	0
03b8e287bd35c46ecd0e030882016a9c2dfedd044766de3b53fd6cd49e6ba88b	και προστασίας από τους θεούς τους,		https://www.openbook.gr/oi-mythoi-mesa-mas/	1	0
03e121e4f67bc919edc82fbae963852be521508fa10df14675530fe0d3234ecd	πάνε καμπόσα χρόνια,		https://www.openbook.gr/atitlo-mythistorima-maria-polydouri/	1	0
03e92c10c3aee1e37d44a77b6901cd73a7e6bd7debc0aad97a3e9aa05ccd3055	Τον Μάγκα, Κυρία, αποκρίθηκε ο αμαξάς		https://www.openbook.gr/magkas/ public domain book / ?? ???? ??? ????????? ????? ??????? ??? ????? ?????, ????? ????? ???????? 70 ??? ??? ??? ?????? ???	1	0
0407a49143338b3c3d67c1fff0d838d99ab3b2f9d3c742e2f986a0f21962bc03	Ένα σημαντικό κομμάτι της ιστορίας του δικαίου είναι η νομική αρχαιολογία.		https://hf.co/datasets/nyuuzyou/chatgpt-in-russia-qa	1	0
043bdab5f25b956c89e8d5ffc6eaaa60e1f0ddbdb550f64e9b6cef324540af83	οι κοινότητες μεταμόρφωναν τους μύθους,		https://www.openbook.gr/oi-mythoi-mesa-mas/	1	0
044c8f57ec27d79f93e65a9fb87341e5fe41bf1382f6cf53284f8e6e6246df82	Μα τι έπαθες;		https://www.openbook.gr/magkas/ public domain book / ?? ???? ??? ????????? ????? ??????? ??? ????? ?????, ????? ????? ???????? 70 ??? ??? ??? ?????? ???	1	0
0492c7b37134ee598b055aa8ad655c1706fe2659c91d8569f6a575bcd0422ada	να ερευνήσουν τα κρυμμένα μονοπάτια της,		https://www.openbook.gr/oi-mythoi-mesa-mas/	1	0
04d11999a6c9dc836110431274cbf92e2468d0bd0156daa0be50d432f3085e8a	Σβήσε τα φώτα.		Αυτοαναφορά	1	0
051feb46959280f7923b201f4d2c5d536e06082b30d044582334246d4274a0e4	Εγώ δεν έχω ανατροφή		https://www.openbook.gr/magkas/ public domain book / ?? ???? ??? ????????? ????? ??????? ??? ????? ?????, ????? ????? ???????? 70 ??? ??? ??? ?????? ???	1	0
0528353043304c01eb6f243fa09692d9afd3a676540f5938db7b32025834e032	Οι γνώσεις όμως και οι διαγνώσεις των δικών μας αναγκών		https://www.openbook.gr/oi-mythoi-mesa-mas/	1	0
053e375c85d4538a2d9f7bb1fdacc4446a9235c40246fc7019b7030bb9d7912a	Δεν έχανε περίσταση να μαντατεύει τα παιδιά στη μητέρα		https://www.openbook.gr/magkas/ public domain book / ?? ???? ??? ????????? ????? ??????? ??? ????? ?????, ????? ????? ???????? 70 ??? ??? ??? ?????? ???	1	0
057d30c2698a5a0a3424b41c3e1a6b1c597c7a80a1c9e3a2b0ba80372badfb18	Και πού είναι τώρα;		https://www.openbook.gr/magkas/ public domain book / ?? ???? ??? ????????? ????? ??????? ??? ????? ?????, ????? ????? ???????? 70 ??? ??? ??? ?????? ???	1	0
05b6c65cd487511285fc3d152578f22d69f0f2d859c89cab3f7f9161d24528cf	Πως με νόμιζαν τ' αφεντικά μου πιστό, ενώ αρνήθηκα να γυρίσω πίσω, ήταν πραγματικό		https://www.openbook.gr/magkas/ public domain book / ?? ???? ??? ????????? ????? ??????? ??? ????? ?????, ????? ????? ???????? 70 ??? ??? ??? ?????? ???	1	0
05cff3ecbf8f4a1f25af67344856e74729a0f71a810ffe83312cff22c90596cc	Θέλω να ελπίζω πως θα είναι ενδιαφέρουσα,		https://www.openbook.gr/oi-mythoi-mesa-mas/	1	0
060b4453735bc78077ff7e3b0068fcdac5b96919de7270d9f5f35fc8d3fa26b2	ρώτησε στενοχωρημένη η κυρά, καθώς τις είδε στο βάθος του ζεμπιλιού		https://www.openbook.gr/magkas/ public domain book / ?? ???? ??? ????????? ????? ??????? ??? ????? ?????, ????? ????? ???????? 70 ??? ??? ??? ?????? ???	1	0
0664b4d52b3cf6cdee7bb2706daa6d60c15a9274d3323e60a4a17d4147e40328	Δεν είχε ανάγκη από κεντρίσματα για να τρέξει σ' όλους τους δρόμους του κήπου.		https://www.openbook.gr/magkas/ public domain book / ?? ???? ??? ????????? ????? ??????? ??? ????? ?????, ????? ????? ???????? 70 ??? ??? ??? ?????? ???	1	0
0667bde0b6fd2df01e7349c64634df17d5d9533522d26430c05558e78f20af37	Δηλαδή;		https://www.openbook.gr/magkas/ public domain book / ?? ???? ??? ????????? ????? ??????? ??? ????? ?????, ????? ????? ???????? 70 ??? ??? ??? ?????? ???	1	0
06a7bc525cb0b942538241abde0bd0b7396bae77a0911c32a42bdfdb60806d0e	Σιωπηλά έπλεκε ο περιβολάρης τα τελευταία τριαντάφυλλα στο χερούλι του πανεριού		https://www.openbook.gr/magkas/ public domain book / ?? ???? ??? ????????? ????? ??????? ??? ????? ?????, ????? ????? ???????? 70 ??? ??? ??? ?????? ???	1	0
06f609b30786e413923faa509628c0b9ed9f5dfb55eefc3d92f5dd8875de44a7	Για τί αγωνιζόμαστε;		https://www.marxists.org/ellinika/archive/pouliop/works/1937/06/popfront.htm	1	0
07205afe22ff37a743a5ea1b28b599d5481521a171bd9081c0f1b022676a3c36	μα τώρα θα φύγει, θα πιάσει δικό του σπίτι γιατί θέλει ησυχία λέει.		https://www.openbook.gr/atitlo-mythistorima-maria-polydouri/	1	0
07516d0d912d92dcb8ab8f7328a6eb2d93008f0928b0dc94672a7a23de4a31aa	Κόψε τον με τα δόντια σου.		https://www.openbook.gr/magkas/ public domain book / ?? ???? ??? ????????? ????? ??????? ??? ????? ?????, ????? ????? ???????? 70 ??? ??? ??? ?????? ???	1	0
0759c5a932140d723d242e2d28b33aa4ef9716e82c399c4c46f4cd6c55835d3d	Ε, ιδιοτροπία παιδιάστικη, τι ησυχία;		https://www.openbook.gr/atitlo-mythistorima-maria-polydouri/	1	0
0792fd5f51f8b4abec42f793354e0b860d4f0555c4c8f2b23412cbaacf58cbaa	Κοντοστάθηκα μια στιγμή		https://www.openbook.gr/magkas/ public domain book / ?? ???? ??? ????????? ????? ??????? ??? ????? ?????, ????? ????? ???????? 70 ??? ??? ??? ?????? ???	1	0
0798b5555c326b8c49941dc8d038b15fa9742a6dc6a6f752bc78e9b50ee7c97e	Ούτε προσφάγι δεν ήταν η πίτα!		https://www.openbook.gr/magkas/ public domain book / ?? ???? ??? ????????? ????? ??????? ??? ????? ?????, ????? ????? ???????? 70 ??? ??? ??? ?????? ???	1	0
07c3fe0505d0cd424fbca066c63a874c4b66ddd36760b6cd38c1449ba02d2d72	Και πήγε στο Ζέλοβο όπου έκρυψε σ' ένα σπίτι το τίμιο φορτίο του		sentence-collector	1	0
07dc59c880759751f6daa92a5216cfaabbf709db04367024b42e730f4a63cb16	δεν της έδινε το θέμα στους διαγωνισμούς κ’ έπαιρνε κάθε φορά δέκα;		https://www.openbook.gr/atitlo-mythistorima-maria-polydouri/	1	0
07f9df97d23f94bbb2b6761a0c366e46dde4035adf4b5ea73f5fdb8a0b3cb503	ρώτησε πιο απότομα η Άννα.		https://www.openbook.gr/magkas/ public domain book / ?? ???? ??? ????????? ????? ??????? ??? ????? ?????, ????? ????? ???????? 70 ??? ??? ??? ?????? ???	1	0
083ab9d83900c21eef04426c57f06cbc7ad2154da627aaaa7d49cf116d1172fb	Πάνε και πολλά άλλα πράματα μαζί, είπε η Γιαγιά.		https://www.openbook.gr/magkas/ public domain book / ?? ???? ??? ????????? ????? ??????? ??? ????? ?????, ????? ????? ???????? 70 ??? ??? ??? ?????? ???	1	0
0885d516731906f7cfa9540b1d057ab22bbc044ad6b72861c88ee42111f86ee4	Η Μαριγώ έτριβε τις μπότες του, ώσπου γυάλισαν σαν καθρέφτες		https://www.openbook.gr/magkas/ public domain book / ?? ???? ??? ????????? ????? ??????? ??? ????? ?????, ????? ????? ???????? 70 ??? ??? ??? ?????? ???	1	0
0921ddc96424fe0fa05206970ca497561ace7a794cfea770283ca6894a240f1f	Και ξαναγονάτισε ο Βασίλης να τη δέσει.		https://www.openbook.gr/magkas/ public domain book / ?? ???? ??? ????????? ????? ??????? ??? ????? ?????, ????? ????? ???????? 70 ??? ??? ??? ?????? ???	1	0
092f5495f30d7270c64127528e00e64779060de8ae97109865b1153e1369dde2	Κι έσβησε το παραθυράκι, ο σκύλος χάθηκε, και μπροστά μου ήταν ένα θαμπό ξύλο		https://www.openbook.gr/magkas/ public domain book / ?? ???? ??? ????????? ????? ??????? ??? ????? ?????, ????? ????? ???????? 70 ??? ??? ??? ?????? ???	1	0
09401691c2cd7ca3958b0012c4daef9ef1e56f50347f3a53723b62a0a711bf8b	με πολύ ενδιαφέρον, ωραία και έξυπνη πολύ,		https://www.openbook.gr/atitlo-mythistorima-maria-polydouri/	1	0
094e6d2c096d1de5f3fd6e43378b7e5be61cb220d8ddfa64f0116ab513d9daeb	Τότε έσκυψε μες στην τρύπα ο Σωτήρης, και φώναξε, κοιτάζοντας κάτω αυτή τη φορά:		https://www.openbook.gr/magkas/ public domain book / ?? ???? ??? ????????? ????? ??????? ??? ????? ?????, ????? ????? ???????? 70 ??? ??? ??? ?????? ???	1	0
0973f33db2ec510d39cdc235acd62d78143ecef29b59f98d396a27e101501062	Ως τώρα ήξερα πως αγαπά μανιωδώς τη μουσική		https://www.openbook.gr/atitlo-mythistorima-maria-polydouri/	1	0
09825c6d4cc5b03f413df8216be07e7af4866fb577eded000862da016fb753e4	Και τωόντι την έριξε ο Αράπης		https://www.openbook.gr/magkas/ public domain book / ?? ???? ??? ????????? ????? ??????? ??? ????? ?????, ????? ????? ???????? 70 ??? ??? ??? ?????? ???	1	0
099707e4321cbe595a35e67633695b7e8baacc2daeae12f0e8c7c16c28600c33	Θα περάσει και αυτό, είπε παρηγορητικά η Μαριγώ.		https://www.openbook.gr/magkas/ public domain book / ?? ???? ??? ????????? ????? ??????? ??? ????? ?????, ????? ????? ???????? 70 ??? ??? ??? ?????? ???	1	0
09cd8477190132df976feff7917bdcaa7b4b61570f76e934ba46cfddf75377e1	Ο Περικλής τι σχέση έχει με όλα αυτά;		https://www.openbook.gr/magkas/ public domain book / ?? ???? ??? ????????? ????? ??????? ??? ????? ?????, ????? ????? ???????? 70 ??? ??? ??? ?????? ???	1	0
09ebaae6f16e1e13cc58952610cab07763915bf3372a319e4c5cf7e7e791fe6e	ο αναθεματισμένος ο οδοντογιατρός της κ. Τσουκρής, μολονότι πατριώτης της,		https://www.openbook.gr/atitlo-mythistorima-maria-polydouri/	1	0
09ebabb621af01a24e556f0dcef224eb6c09ddc63ac8c9fb895ea98cb2f9883f	Ανέβηκε τρεχάτη και ξανακατέβηκε μ' ένα μποτιλάκι μαύρο και μ' ένα μάτσο κουρέλια άσπρα		https://www.openbook.gr/magkas/ public domain book / ?? ???? ??? ????????? ????? ??????? ??? ????? ?????, ????? ????? ???????? 70 ??? ??? ??? ?????? ???	1	0
0a45d668cbc8fa08baf6b2faf30656fcec2e5d7b2497165d0877692bab497ce9	ξεφώνισε.		https://www.openbook.gr/magkas/ public domain book / ?? ???? ??? ????????? ????? ??????? ??? ????? ?????, ????? ????? ???????? 70 ??? ??? ??? ?????? ???	1	0
0a9c365ba765c22ba84ecda39b0152ddb42a36f8dc4546571d1ceba116dd928d	προκειμένου να κολακέψουν και να αρέσουν στους άρχοντες και στους βασιλιάδες τους.		https://www.openbook.gr/oi-mythoi-mesa-mas/	1	0
0aa23f45dce8130f38b1c3c3a114f439e03127a8d10000fd8ef399cb8a0b57a0	Δεν έκανες καλά!		https://www.openbook.gr/magkas/ public domain book / ?? ???? ??? ????????? ????? ??????? ??? ????? ?????, ????? ????? ???????? 70 ??? ??? ??? ?????? ???	1	0
0aa289fc4561ee5ce279008cec4e320a610e3b43e9760830ae3c2d7b7b8a0aa0	Οι δίδυμες μάθαιναν να πλέκουν		https://www.openbook.gr/magkas/ public domain book / ?? ???? ??? ????????? ????? ??????? ??? ????? ?????, ????? ????? ???????? 70 ??? ??? ??? ?????? ???	1	0
0ad535559308e7b6b57ce16e06a3604957ea498ced0192b097cbcc59abd0db21	Ζεμπίλι ήταν κάμαρα Βασίλη.		https://www.openbook.gr/magkas/ public domain book / ?? ???? ??? ????????? ????? ??????? ??? ????? ?????, ????? ????? ???????? 70 ??? ??? ??? ?????? ???	1	0
0b74505e6a688e63ec584b4ea108b941ffd57868f56a7d4c57d365fee1b1c298	Θα μείνει πολύ;		https://www.openbook.gr/magkas/ public domain book / ?? ???? ??? ????????? ????? ??????? ??? ????? ?????, ????? ????? ???????? 70 ??? ??? ??? ?????? ???	1	0
0b900365b1f3ea0043ea528b6f1a23437bf7776122563e811d8a47e1ca8d6fe3	Εσύ είσαι δούλος των αναγκών σου.		https://www.openbook.gr/magkas/ public domain book / ?? ???? ??? ????????? ????? ??????? ??? ????? ?????, ????? ????? ???????? 70 ??? ??? ??? ?????? ???	1	0
0bdaef02129f69acb7db61762f021efbe23a09c170b350b6986e73cd0f8cdc0d	Και μου είπε, πώς τη νύχτα, μπήκε στο Μεσολόγγι με τους τελευταίους άντρες του.		https://www.openbook.gr/magkas/ public domain book / ?? ???? ??? ????????? ????? ??????? ??? ????? ?????, ????? ????? ???????? 70 ??? ??? ??? ?????? ???	1	0
0bdf1e2b68e098b488e5accaf92c172272ad37f365cf2047312dcbae91e9a312	Ο Μήτσος γύρισε στη Μαριγώ που έστεκε στην πόρτα κλαμένη.		https://www.openbook.gr/magkas/ public domain book / ?? ???? ??? ????????? ????? ??????? ??? ????? ?????, ????? ????? ???????? 70 ??? ??? ??? ?????? ???	1	0
0be217457d40474e6080620fdfb2226cd29d350d095e6b57cd884f4dace73fac	Γιατί νομίζω πως τελείωσαν τα βάσανα μου!		https://www.openbook.gr/magkas/ public domain book / ?? ???? ??? ????????? ????? ??????? ??? ????? ?????, ????? ????? ???????? 70 ??? ??? ??? ?????? ???	1	0
0c0cc12b708b2788674b29456dcf505bdd872d7c0752b9d182820e55503ba3a0	Όλοι οι Βούλγαροι ένα είναι		https://www.openbook.gr/magkas/ public domain book / ?? ???? ??? ????????? ????? ??????? ??? ????? ?????, ????? ????? ???????? 70 ??? ??? ??? ?????? ???	1	0
0c0f9eb122589f600242a7944325506ff63b3f6ff29afff0552f6e55e3be7fed	Με τον Σωκράτη έκανα συχνά παρέα		https://www.openbook.gr/magkas/ public domain book / ?? ???? ??? ????????? ????? ??????? ??? ????? ?????, ????? ????? ???????? 70 ??? ??? ??? ?????? ???	1	0
0c2f270aa320b7b67460c99673b276f4d4d69c71a31a49783b5f19884d25af4e	Πουθενά δεν ήταν		https://www.openbook.gr/magkas/ public domain book / ?? ???? ??? ????????? ????? ??????? ??? ????? ?????, ????? ????? ???????? 70 ??? ??? ??? ?????? ???	1	0
0d214bba8828c455611f71ed1be05ac3ef00f3ee4ea40e967ce2b81991b85e9a	ούτε γέρος είναι να πεις, ούτε άσκημος,		https://www.openbook.gr/atitlo-mythistorima-maria-polydouri/	1	0
0d4bcce4e18c0feafc35564a259296cf1c22580ac7ac988bb70872429bb75509	Μα θα είναι βρισιά αλεπουδίσια		https://www.openbook.gr/magkas/ public domain book / ?? ???? ??? ????????? ????? ??????? ??? ????? ?????, ????? ????? ???????? 70 ??? ??? ??? ?????? ???	1	0
0d63bb6afa08394ce054fde9227bc56d6b43586591613261ff292fd1025890ca	και να μας χαρίσει τον χρόνο που χρειάζεται για να τα σκεφθούμε καλύτερα		https://www.openbook.gr/oi-mythoi-mesa-mas/	1	0
0dab4421ac9e51de89f6c05eb5a5b63bc415032beafd5511c28a9e7d023fcacf	Ο Μάγκας βρήκε αυτά στο περιβόλι		https://www.openbook.gr/magkas/ public domain book / ?? ???? ??? ????????? ????? ??????? ??? ????? ?????, ????? ????? ???????? 70 ??? ??? ??? ?????? ???	1	0
0df9b74b258efeb2fec74a92b7f1b83ed9c9ebd57ff70441de582a41fc0feae8	Μα δεν παν τα χνώτα μας μαζί		https://www.openbook.gr/magkas/ public domain book / ?? ???? ??? ????????? ????? ??????? ??? ????? ?????, ????? ????? ???????? 70 ??? ??? ??? ?????? ???	1	0
0dfb1d99d7a1aec80c14695389b8e4b1284d79207a81fe32d1685f24590e5670	διέκοψε ο Χρήστος.		https://www.openbook.gr/magkas/ public domain book / ?? ???? ??? ????????? ????? ??????? ??? ????? ?????, ????? ????? ???????? 70 ??? ??? ??? ?????? ???	1	0
0e339395a63da407c41d2a246c7a51bb3e151869958fa228aa38eb2deedc5d39	Δε φοβάσαι να σε δουν εκεί που δουλεύεις;		https://www.openbook.gr/magkas/ public domain book / ?? ???? ??? ????????? ????? ??????? ??? ????? ?????, ????? ????? ???????? 70 ??? ??? ??? ?????? ???	1	0
0e70d017961911d5a6984f74a12ef6ecba862acb97993c48d9de3c9b91c3f80d	Η Άννα κοκκίνισε, κι έκανε να την κλωτσήσει		https://www.openbook.gr/magkas/ public domain book / ?? ???? ??? ????????? ????? ??????? ??? ????? ?????, ????? ????? ???????? 70 ??? ??? ??? ?????? ???	1	0
0eba7f501efe7232aeb8ea5d9a7b995f2850f4b6cc22739233a911d80c661bde	Κοντοστάθηκε και με κοίταξε		https://www.openbook.gr/magkas/ public domain book / ?? ???? ??? ????????? ????? ??????? ??? ????? ?????, ????? ????? ???????? 70 ??? ??? ??? ?????? ???	1	0
0ebe474d9e6b7113829277d47ab7fb325bc4de83ff140d2c7b313e21a56be869	Μα πίσω από το λόφο βρίσκεται η θάλασσα		https://www.openbook.gr/magkas/ public domain book / ?? ???? ??? ????????? ????? ??????? ??? ????? ?????, ????? ????? ???????? 70 ??? ??? ??? ?????? ???	1	0
0ee797ce12da92d744e393d54654d6bacca23b4c7edebbf6758ca42d7fbe0246	Τι έχεις, Μπόμπη;		https://www.openbook.gr/magkas/ public domain book / ?? ???? ??? ????????? ????? ??????? ??? ????? ?????, ????? ????? ???????? 70 ??? ??? ??? ?????? ???	1	0
0f24c118809f2527c16d49423ff2cf5c993247f4c8be0cfba5ce168f1c12a4a5	Άιντε, σήκω πάνω!		https://www.openbook.gr/magkas/ public domain book / ?? ???? ??? ????????? ????? ??????? ??? ????? ?????, ????? ????? ???????? 70 ??? ??? ??? ?????? ???	1	0
0f2cc12da459f58a66bea85a5925244a98e65c00df3a14b09c67ea4e074af6c6	Να ξέρεις πως δεν έχεις να φύγεις.		https://www.openbook.gr/magkas/ public domain book / ?? ???? ??? ????????? ????? ??????? ??? ????? ?????, ????? ????? ???????? 70 ??? ??? ??? ?????? ???	1	0
0f3f00c455efd5f42739129e2a754f291a829bab8ec1354bbb8630192f47d4db	Θα δάγκανα τον εαυτό μου από θυμό		sentence-collector	1	0
0f5f1b71b6ceb54e3a6cbeb98e4e9e7b2c09ededa8bdd78e0c06d572576b93f5	Πολλά αμάξια κατάφθαναν με φίλους και συγγενείς, που έρχουνταν να ξεπροβοδίσουν τους ταξιδιώτες		https://www.openbook.gr/magkas/ public domain book / ?? ???? ??? ????????? ????? ??????? ??? ????? ?????, ????? ????? ???????? 70 ??? ??? ??? ?????? ???	1	0
0f860a4881a3990eb45bbaeb2341998d6a7bfd56de859330b4b1961cfa6b88e3	Πώς να κάνουν τους Τούρκους να πιστέψουν πως είναι πολλοί;		https://www.openbook.gr/magkas/ public domain book / ?? ???? ??? ????????? ????? ??????? ??? ????? ?????, ????? ????? ???????? 70 ??? ??? ??? ?????? ???	1	0
0fa6a24d27e5d9a9bbb71e68e3385757095b4a70c94ba7bc6ea7ef8d3da16cf3	Η πίτα είναι πίτα και το ψάρι είναι ψάρι.		https://www.openbook.gr/magkas/ public domain book / ?? ???? ??? ????????? ????? ??????? ??? ????? ?????, ????? ????? ???????? 70 ??? ??? ??? ?????? ???	1	0
0fed2bb41d6d4dd53a711014df6d9fce63d12691bfa04890990a7bcae82d3ed7	Πήραμε την ακρογιαλιά κατά τη χώρα		https://www.openbook.gr/magkas/ public domain book / ?? ???? ??? ????????? ????? ??????? ??? ????? ?????, ????? ????? ???????? 70 ??? ??? ??? ?????? ???	1	0
0feea2348bc3b09619cd9b242b5ab5e67a945cc8cf1dce5568e20962daf1eca6	Και πέρασε πολλή ώρα.		https://www.openbook.gr/magkas/ public domain book / ?? ???? ??? ????????? ????? ??????? ??? ????? ?????, ????? ????? ???????? 70 ??? ??? ??? ?????? ???	1	0
104d0bd14da66a08d4d1c792ef99c1645ff7b79ca613cb9ca3f1a429db400311	Ώσπου να πεις τρία, είχε περάσει στο βασίλειο του χάρου.		https://www.openbook.gr/magkas/ public domain book / ?? ???? ??? ????????? ????? ??????? ??? ????? ?????, ????? ????? ???????? 70 ??? ??? ??? ?????? ???	1	0
106ebffc296fb8aea475cc3860f43ab281fd7db68223d93662b640d25bfc1596	Αέρα!		https://www.openbook.gr/magkas/ public domain book / ?? ???? ??? ????????? ????? ??????? ??? ????? ?????, ????? ????? ???????? 70 ??? ??? ??? ?????? ???	1	0
107db8ef6a8389fb18ef1af13a3c4d507b2d0dc568096f588648bd67bedf1c64	Εδώ είμαι κι εγώ!		https://www.openbook.gr/magkas/ public domain book / ?? ???? ??? ????????? ????? ??????? ??? ????? ?????, ????? ????? ???????? 70 ??? ??? ??? ?????? ???	1	0
108a0703b83c7bd0e6c63348b3240f5fc1101c1bd2cfd0ed9905808064cbedbe	Ρίχθηκα στο περβάζι γαβγίζοντας με λύσσα.		https://www.openbook.gr/magkas/ public domain book / ?? ???? ??? ????????? ????? ??????? ??? ????? ?????, ????? ????? ???????? 70 ??? ??? ??? ?????? ???	1	0
109c2529de2e6d5297364bf35ce3a9b7d9ac4887db7fdb869998b7d232355966	που σχετίζονται με την πρώτη δημιουργία,		https://www.openbook.gr/oi-mythoi-mesa-mas/	1	0
10b01fbba9e658c8792f9912996a8aa12edcce7bd887adc5fcd9ea2b928484ed	Και στο στάβλο απλώθηκε σιωπή		https://www.openbook.gr/magkas/ public domain book / ?? ???? ??? ????????? ????? ??????? ??? ????? ?????, ????? ????? ???????? 70 ??? ??? ??? ?????? ???	1	0
10bb900f3704623c26e9b33b07518a960f10d84bd54617e942f7c6f5083665eb	Ο γιος σου αρρώστησε, γιατί έφαγε ένα ζεμπίλι κουρμάδες		https://www.openbook.gr/magkas/ public domain book / ?? ???? ??? ????????? ????? ??????? ??? ????? ?????, ????? ????? ???????? 70 ??? ??? ??? ?????? ???	1	0
10fca37945d4efd1c696c5b67b3143605e693c8c0e1fb627769013e88647cc59	Είναι σαν να γευόμαστε, συμπληρώνει, το εκλεκτό νέκταρ των αθανάτων.		https://www.openbook.gr/oi-mythoi-mesa-mas/	1	0
110a45801546fc43933e5a2689feadbe2bd5eadc89508e7e2687b57c4faef889	Μα ήταν θυμωμένος		https://www.openbook.gr/magkas/ public domain book / ?? ???? ??? ????????? ????? ??????? ??? ????? ?????, ????? ????? ???????? 70 ??? ??? ??? ?????? ???	1	0
1113bf5ed28fe067205a1562edfd1a4e18f67992e52c628121986bf48e800115	Και θα τις σκότωνα όλες.		https://www.openbook.gr/magkas/ public domain book / ?? ???? ??? ????????? ????? ??????? ??? ????? ?????, ????? ????? ???????? 70 ??? ??? ??? ?????? ???	1	0
111fb4e76181ce5aeee4a41d2619e11a4107f12542d1c6b00b49f4f3be29a028	Είμαστε μακριά από τη χώρα, είπε		https://www.openbook.gr/magkas/ public domain book / ?? ???? ??? ????????? ????? ??????? ??? ????? ?????, ????? ????? ???????? 70 ??? ??? ??? ?????? ???	1	0
11345ed016eeb7302d3cd7cb288b8e099f0b9f1c6af0b42aff943e8a24f1cae5	στον υπερθετικό βαθμό λόγω της τεράστιας ενδοχώρας που θα πρέπει να καλύψει ενεργειακά.		https://www.openbook.gr/poio-to-mellon-tis-alexandroypolis/	1	0
113682a1ec7af67485ebbe4af006dfeec8e67adc2f0e73a458bdc304d5e80f4e	ρώτησε κείνος.		https://www.openbook.gr/magkas/ public domain book / ?? ???? ??? ????????? ????? ??????? ??? ????? ?????, ????? ????? ???????? 70 ??? ??? ??? ?????? ???	1	0
1153800c46f31d9ebf46a5b594c221b534f8180f310e698000d280f8fd667293	είπε με συγκίνηση		https://www.openbook.gr/magkas/ public domain book / ?? ???? ??? ????????? ????? ??????? ??? ????? ?????, ????? ????? ???????? 70 ??? ??? ??? ?????? ???	1	0
