sentence_id	sentence	sentence_domain	source	is_used	clips_count
e1a3c9a1ffb2241947f7834dbf74350ba6715b3cc517530f620107e4c119aae2	από τη μιαν ακροποταμιά στην άλλη		sentence-collector	1	5
e1ae674fb71812214e2af2f8b1c22381936d2c633acc753cfeecf98a79c9af53	Και για να μην τον κακοκαρδίσει		sentence-collector	1	5
e1b393a66f70bcb83f705869c4f514cd23be73787de80b8b830962b49f2dfaba	Τώρα έχουμε ανάγκη από φλουριά, πολλά φλουριά.		sentence-collector	1	5
e1b64adc1b93f5ffd1df977599a752caf05bc5f23b3065accaec70aa84a2ed97	Τι θα κάνεις;		sentence-collector	1	5
e1b675c9851af200ccadbe1ab8c84070b2e564b321a83e1009875843527b657b	που ξεχώριζε ανάμεσα στα πράσινα δέντρα.		sentence-collector	1	5
e1ba42da98704dd5dfc0a70dee544a619f6888da0a040808c099e2c910f1e765	Ετούτη είναι τιμημένη γη.		sentence-collector	1	5
e1c506d8423f01d6e4988f9a4c55acce9010a9be3f1fae9798d7fd2c5ce5e4ec	ξεχνά πως έχω ανάγκες κι εγώ		sentence-collector	1	5
e1ca828f03ee40679a82a594be7f9372196b550d530ab87fe750363cbdc97f46	Μα μόλις τον είδε κοντοστάθηκε.		sentence-collector	1	5
e1e189c2ff0d005733c2588974c2873f0b238efd80fd9ea8649a794b425a5d1e	Το παλικάρι πέθανε.		sentence-collector	1	5
e1e2e32cfea511d416ee96867492e3f124546053e27d566eadcc564b6644e082	Το Βασιλόπουλο σηκώθηκε αηδιασμένο.		sentence-collector	1	5
e1f9ec69740784e1a3abc96b5c1cab6c8aa7f07b6d74c71497339a13781ff81b	Έχω να σου πω για τον Κακομοιρίδη.		sentence-collector	1	5
e20f3134ef213aaa23f053074026c0970313e2a0763e25851d97badc426690d2	Κάθισε στην πέτρα κοντά της και ακούμπησε το σαγόνι του στο χέρι του συλλογισμένος		sentence-collector	1	5
e211c34a3be79117f2cd4244a53f0ac15c9d27aad7a065624400bb63e5faed09	Τι να πρωτοκάνω με τόσο λίγα;		sentence-collector	1	5
e22eef4d6826e668cc6aa32231b70a97d0e4c5c2892f34bcab788d7c66c12dfb	Μόνο να τελειώσω πρώτα τις δουλειές μου με το φίλο μου τον Λαγόκαρδο.		sentence-collector	1	5
e231d43588411ed1cd2b34d01642aa719ae7e41528adc780549ba2f1197b7adc	Μα ο νέος δεν αποκρίθηκε, ούτε σάλεψε πια.		sentence-collector	1	5
e23740e21bb24ce96ad3236bd09ffb840e21b1997285148eef8fbeed95165f9c	Και με λαφριά βήματα κατέβαιναν το βουνό		sentence-collector	1	5
e24d255466db616680ebeb24a1f97ecb51a06e9966a6ce3e6c764ef406a7de11	ξέρει βέλη να κάνει και λόγχες		sentence-collector	1	5
e252ba3254e853c3bc5298aafe40ccd07eedf2b70769781d0ab27e49c7c5375f	πάρτε το αυτό και βάλτε το πάλι μπροστά		sentence-collector	1	5
e25e24ebe6c01e76c1776d09db845863ef354b91fbdf5576c96a73979c6faea0	Και ποιος σε υποχρεώνει να μείνεις δάσκαλος;		sentence-collector	1	5
e26061a1e814dd906e66f4697230c54762af79e6c31281181a5796688cb3e9c7	τεντώνει το κορμί της σαν να τη φύσηξε αέρας και συνεχίζει να γράφει		sentence-collector	1	5
e262286ae1653ed43f3ca5fc60694da3849aea08e0ae9011e37adfeb02b82f56	γιατί είναι κλέφτες ή δειλοί		sentence-collector	1	5
e26428574125d1fc56776f75184e775d20fa70f468da219eb45cd0be601b6463	Σε ξέρει η μάνα μου.		sentence-collector	1	5
e27da99c9812261c1c7ed1be1a2a577420e96d13a0f20874052f68ff50e1323f	Μου κακοφαίνεται μόνο που δε μου βρίσκεται τίποτα να σας φιλέψω		sentence-collector	1	5
e28d884862531c4e8982f7970a426b754301722564d9df8dcc950ed08e38b001	Μα η γριά χαμογέλασε μόνο.		sentence-collector	1	5
e29c4e8fd9bd37c77c9a784f55721d0c5b69638a27ad1738eba207da30337180	Εσύ τους ξύπνησες, εσύ είσαι άξιος να τους κυβερνήσεις!		sentence-collector	1	5
e29e563abfa1452278ccb8e5fdac96a3bf1dbc1272762903813a35d8b78be137	Λοιπόν σου στέλνω ένα δώρο που θα σου μείνει πάντα		sentence-collector	1	5
e29f529e4560fb9e281514113c6802a0a57cae84103d4a3052bee96f268deffc	Εκείνη η ημέρα ήταν εορτή σε όλο το κράτος.		sentence-collector	1	5
e2a421e83d7028c92a46847b1d208e5694ef89e7f0263bf9176bac060b73ee6f	Έλα μαζί μου, είπε, θα σκάσω εδώ μέσα!		sentence-collector	1	5
e2a547586518409dfcbbc95fd9a5bfa7b9fcaa6dcc3cd82720c02368a47ee885	ενώ γυρνώντας τη ράχη η μια στην άλλη		sentence-collector	1	5
e2aede39c46e7184be292c6d63f088cef43c294b5950dd69c1b22ccf591615c4	Την ώρα που ανεβάζουν σιδερόπετρες από τα πηγάδια		sentence-collector	1	5
e2c08e0943e771f71967d0fc702c5f86f3e2dcda0e9ac150adace6cceed9d4da	και ξεσκέπασε ένα δέμα τυλιγμένο σ' ένα μεταξωτό κόκκινο μαντίλι		sentence-collector	1	5
e2f1c2aaa8b7f2beb4bc27f6ea03d44970b5b6db8547504210bb02500b22aa89	Ο Κακομοιρίδης τον κοίταξε με αηδία.		sentence-collector	1	5
e306fda6e151540551e678bbaa43c53a0f2d927a61af18def29a3af431cab722	με τα χέρια δεμένα		sentence-collector	1	5
e30bf3bb1101b0bd13524cee4401ad664d162c2a0cc9f652e02cb46b786ef7b8	Και για το στόλο μου πληρώνω.		sentence-collector	1	5
e3190dcdf9defdf4d2b7070de65a7ffeb41982c9b9a8e45f9593a50e88497386	Τα πόδια της που μόλις σκεπάζονταν από τα σχισμένα μεταξωτά της παπουτσάκια		sentence-collector	1	5
e322a1ad609725e9c6436f0f392f46b3066ef9ba76563bb7aca0142e7b984433	Πάλι η νεαρούλα νοσηλεύτρια στα δεξιά της		sentence-collector	1	5
e33d375082565700c3d9f875903742f069a339aba302ab805a3dd8b4ae28e12b	που το είχαν φτιάσει τα δικά του χέρια.		sentence-collector	1	5
e34be4d469316707b939651741466dc63c99c4e58b05314bc8f2c348cd9809f0	Φθάνει όμως να βγει το Βασιλόπουλο.		sentence-collector	1	5
e34d9b5b3dfc1bb6780c5c806597ffe1416787538171fc5e6fa477cfd0fd1a5f	Την υπογραφή του κλέφτη, αποκρίθηκε το Βασιλόπουλο.		sentence-collector	1	5
e35c39015f2f7461b6c970ccb559dfb95f2f6cc43adaf654170017e4d745333b	Και με το γιο του, βιαστικά πήγε στον ποταμό		sentence-collector	1	5
e36b45ba014aff0dbae8331250ee4f391065bbfa18111717920c0e3b2cc0b221	Γυναίκες είστε να φοβάστε;		sentence-collector	1	5
e371e9d2ce1e0b1b6e60ee9a14844a0cad98fd0658b4afb6365b1e4307eecda1	Τον έπιασε τρομάρα.		sentence-collector	1	5
e3891456d82fa42324a3aa546e905ecba995c7cb948eaaf34d0e6a2cc58b2205	είπε η Γνώση.		sentence-collector	1	5
e39932310fedb86e9492022e2ed44bd38e8d35ba49869658c148b4b2beff5b6c	έτρεχε στον καθρέφτη και το τύλιγε στα μαλλιά της.		sentence-collector	1	5
e3a08a72cb6ecd9769c023581666961aa3eabbeccdd8003ac4ef1e91296487d9	θα έβλεπε μια μέρα πως πάλι για τον εαυτό του δούλεψε		sentence-collector	1	5
e3a0ba5bce18c02b396b3961a93e394c3d2579de305a082f59612b05120766d1	Ποιος από σας ξέρει να τραβήξει σφενδόνα;		sentence-collector	1	5
e3a743a63284d6495e30a6bbdf433fbc72c2a392c1e666aac91dcc2b687a2375	πέθανε ο καλός μας Βασιλιάς και ο γιος του κοιμάται.		sentence-collector	1	5
e3d9f86615157da100109b569d085eb6fc649bba57566d27fefe278fe867d5b0	το έδωσε του γονατισμένου γιου του		sentence-collector	1	5
e41b74ac7d2045c5cb726317554c639de24d1ebb95f39d52fe6a5fa545a111bd	Όχι, αλλά για την Πατρίδα και για το Βασιλιά!		sentence-collector	1	5
e41e2b928a973ad71e73e368db7b104c4b941253ce34ead0baf47fac0c50ed04	πήγε να παραδώσει του πατέρα του το γράμμα		sentence-collector	1	5
e430cb9870084d7a9f538879576e892d81f7cc73efa87dc25269c1a4341055b6	Ζήτησε τα κλειδιά, και ο δεσμοφύλακας του τα έδωσε		sentence-collector	1	5
e46113c64d5ed4727cfe46e97876f2379c26ca16ddfb8495ae128876d10b5442	Και ύστερα να έλθεις να μου δώσεις λογαριασμό τι είδες και τι δεν είδες.		sentence-collector	1	5
e46d121178cb6f9ba79f2a05cb19c810c95107545ffae6be886c1fb6420bdcc0	Το Βασιλόπουλο τον διέκοψε		sentence-collector	1	5
e482a679f8c8a44afa3e6c75e749b5ef6c6f65a142fff4fc64ff106fda5964ed	Πρέπει να φύγω.		sentence-collector	1	5
e49d5a48b00ea34b93e846e3c7dad0d342b11b11d65b2724b21e028f1143aaff	και της γενικής αποχαυνώσεως.		sentence-collector	1	5
e49eb10221e0d73ccb147c020d08f051c10e496a39c23bfab7166c2360ac27a3	Τότε κατρακύλησα κι εγώ ως κάτω		sentence-collector	1	5
e4b99eecaba443446ed73d645505d60db4080db74f5e30af780ec3f2b60d8006	Άνθρωπος;		sentence-collector	1	5
e4bc4c4db36aae4064e44189363fac3933bdf22caeaaade204238575038dc38c	Κοίταξε μπροστά σου, εκεί, και πες μου, τι βλέπεις;		sentence-collector	1	5
e4d63d8019ed6ff2bd4cc26ca63edc2728cac3e448ebfa07ee80a65fcb3e781d	ενώ ο Βασιλιάς, πεσμένος στο σοφά		sentence-collector	1	5
e4f2dba5578eab6275750347a4c1462f60dfbcb866dabb48c4e0fb48c9c0a312	Εγώ το θυμούμαι!		sentence-collector	1	5
e4f84632ebd949336f83904b8405ef62652ffc9837859762ded870d76e8a111f	Γνώση, κόρη μου, δώσε στα παιδιά να πιουν από το γάλα που αρμέγεις		sentence-collector	1	5
e4f9d95e35ec669c803ef7ce55059f8fdc1fc8df699888d25d4ea12691b9db37	Έχει στα χέρια του το ταμείο του παλατιού.		sentence-collector	1	5
e4fa6aab7706dce4bff52f020f49f6104f4d2d8231548167dbaffc9e06ab42d6	Κακομοιρίδη, άκουσες τις κακές ειδήσεις;		sentence-collector	1	5
e51b8d7a2e71bdd6f87c9e8b5259f54deb25d93562bd754e2251d5f08bf972c6	και με δάκρυα στα μάτια διηγούνταν τη συγκίνηση		sentence-collector	1	5
e525d854f8a2b62f46c2af4ce38cd012e6abc41842f5005d6e9154249fb56834	Γύρισαν και είδαν τον ίδιο άνθρωπο.		sentence-collector	1	5
e5294e5794a8bf576c903663bcd91f3b9cf9f6ea5fc620af9bb1bc77a79afdb7	Σύναξε τους όλους εδώ, αμέσως!		sentence-collector	1	5
e52e1f7331ea377084715e0df8eef6373c8bcf4f9fbef0371b44f97ca6994977	Στο διάβολο, τέτοιοι υπηρέτες σαν τους δικούς μου!		sentence-collector	1	5
e534ce6d66e18e274aaa893791c24b065a0b9810284be05ce605cedbf4d63362	Μα τώρα, αφότου κατέβηκα από το βουνό μας		sentence-collector	1	5
e54ccac0b7f378e22b606ebb794d52e448a063868618ee5ab3d113cb0c17dfad	Διαλέγεις ελληνική στο προφίλ		sentence-collector	1	5
e54cef254e7fd3eb6fd9948d6f901db72821802ed4aa296b83e7c376cabeb1ac	Το πρόσωπο του ήταν αγέλαστο και χλωμό.		sentence-collector	1	5
e54ebd292ee027e0e13253bb6a1da5613b48d683805228c80b52065628cc01d4	Δεν πρέπει ούτε μιαν ώρα να χάσουμε		sentence-collector	1	5
e5545acd966ebcb07af3afdd40251bed5138421e5e9f1e279b15fc00db7bc4dd	Το ρεύμα είναι πολύ δυνατό, είπε ο Πολύδωρος.		sentence-collector	1	5
e57405c8192ba44fa86638c256f716f378310f79f10e8d62da06381be15ab207	Μουρμούρισε μόνο τ' όνομα σου δυο φορές και ξεψύχησε.		sentence-collector	1	5
e577c71525ed84e88d03638ac4a16fc0072e2d151ecfd3666e8ca2907b8e97bc	Να 'ξερες πώς σε περίμενα τόσην ώρα!		sentence-collector	1	5
e5869abc7ce172eefd0163816f1df54553579ef70deb0a82d43e3b4017512023	Βέβαια δεν πήγε στου Άρχοντα εξαδέλφου μας.		sentence-collector	1	5
e588744e28d5c07440f13a43c2368029b598844b69fe991f749505d999608b3f	μα ο πανικός τους έκανε κουφούς και τυφλούς.		sentence-collector	1	5
e58ad3ce8f424e4304c934f376c16e59898cb3024b0c278d24461073fb3e5fa3	Μ' έβαλε το Κράτος δάσκαλο		sentence-collector	1	5
e5ac6b8ccc6f42aab001a78e99ef8c7706679bffbcc1197e69b899b38005ba21	Γύρισε κατά το ποτάμι		sentence-collector	1	5
e5b1c31ec9907f27f3aac9d39bae519308fcaa5097555ca570b34b993f509c91	Χαιρετήσετε τον Πρωτομάρτυρα!		sentence-collector	1	5
e5c684946468f5e873733756720ec61fc8704110b6039c28c438901b64f60ca2	κανείς ακόμα δεν είχε σηκωθεί!		sentence-collector	1	5
e5dc3238b3f15083ed0e6bca7e486b5ee735667e51f11cc23fc2c3e0db399492	Άλλο ένα;		sentence-collector	1	5
e5e216433a7b9baed9a5512419f9a42761021a9ab2f33a2ce09d7d8055ad4121	Μα το ελάφι έχει τέσσερα πόδια, και τούτο έχει μόνο δυο!		sentence-collector	1	5
e5f4471653323da8cf2fe084c06580923c104f9e3d87977aa112306b150556d9	Κι έξαφνα αλλάζοντας τόνο		sentence-collector	1	5
e5f8c72914f7e6551f56676660781e6cd1bff971a9ccfc23b01463e6cf13cdc5	όπου γίνονται τέτοια πράματα!		sentence-collector	1	5
e600c52ba2f977c4ba3b7e01c4a6c022d68ed17239fa5025713608eed0b6bd0e	και οι καρποί τους σάπιζαν κι έπεφταν στο χώμα άχρηστοι.		sentence-collector	1	5
e604be7b4ae3f986c9371d2f50a4fa253756ad589edf3bc1b723704ef9e74be9	το Βασιλόπουλο βρήκε το Βασιλιά με την Ειρηνούλα		sentence-collector	1	5
e61ef81522913107054a46b540c45ca25c6527c6985fef2b07a44a6cf5c76a69	Και βγήκε έξω το Βασιλόπουλο με αναστατωμένη την ψυχή.		sentence-collector	1	5
e659ce29fb98eea504a818adb2d904b545e6f8e3a3b4637d2629f793a039efa9	Άρχισε να τρέχει στο διάδρομο		sentence-collector	1	5
e6876c6f6fb952cabf02854c42f40ed8ed25041ed14fc171b7065452634d12d4	για να μιλήσουν του Βασιλιά.		sentence-collector	1	5
e68ea45d4a6a2a40392cf9a6178d4a8eabf7db782b471433144679171e56d5a7	αποκρίθηκε το Βασιλόπουλο		sentence-collector	1	5
e691492357780cabb9103e58cc7e8de1408e7d2c88548b421b7de55d37877a1c	Θάρρος! Θα γίνουν τα όπλα.		sentence-collector	1	5
e6a199f5639f8d566ae9c60d132a94e84ff8949d928cf67c964cdcc0f5b584b3	Πήγαινε συ όπου θέλεις, πρόσθεσε		sentence-collector	1	5
e6b8f7f2bd66cd56a22930804ba9e339c5bbf53addafd2eeac2cbcc57af40fbc	Μα δε βρήκε κανένα.		sentence-collector	1	5
e6b9dbba0d11a34cec655a4b9fc2226ed46644429b7321ca3ac45e8f9ab076f0	Στην πόρτα κάθουνταν ο νοικοκύρης με το κεφάλι μαντιλοδεμένο		sentence-collector	1	5
e6c3e9725f0b298384fe30c1d2a7cf2f87fe03032c4233e0326bf85bf89137d7	από τις πρώτες δυσκολίες		sentence-collector	1	5
e6c5bbc2d35fa5d673c43604d9f8d9a697e36ab717e32330ac0f03f3e40c929d	Κοιμάται ή γυρνά σε καμιά διασκέδαση, αποκρίθηκε.		sentence-collector	1	5
e6c727af04a8d80bdb8472cb16066746ce00ed75d5c3a9da3cb700e547893412	Κανένα παράθυρο δεν ήταν φωτισμένο.		sentence-collector	1	5
e6ca1527194fbc80e84a847873e3a8e8bc6fe2e674796922b0e3f0bc820d3c32	Η Ειρηνούλα δεν αποκρίθηκε.		sentence-collector	1	5
e6d6f6f5210881010e8a89b110581290831f1ed6c1e0a1ad82dac64ab6361a72	Με μια σπαθιά ο θείος Βασιλιάς του είχε κόψει το κεφάλι.		sentence-collector	1	5
e6e398bd265242b15afbba925fa5b25ebe9dcb5bcdb4db4cbdf929dbc233747f	Ούτε αστείος πια δεν είσαι!		sentence-collector	1	5
e70ae2a7aebc75ae3758cd81917884555c27de36503d2a5515e611135674181e	Το Βασιλόπουλο έβαλε τότε ανθρώπους να μαζέψουν τα σκορπισμένα όπλα του εχθρού.		sentence-collector	1	5
e7116cb01a5620b1713152037090ad22ffbf3cf891f5ca3b752774cc6fba37ae	Το παλάτι μου το προμήθευε.		sentence-collector	1	5
e72469c1c23e7b75a9762531b327eff9b3fb97607e23ebcc7265b7397791fee4	Από το πρωί γυρνώ μαζί σου!		sentence-collector	1	5
e72aa24c44acd287013205950ee7622a3cf98003f59f28d63a4dcee9811805a0	Ούτε να φάει πια δεν έχει		sentence-collector	1	5
e74f75507c78896cdaa63d904703c1e6de430d0aa233e977362e84bb40cf4666	Ήσουν περίπατο;		sentence-collector	1	5
e7520e917077c0a6d3047b9a8ff3767f458c0ad53837857e3a74cf3ecea0e4ff	Άσχημα πράγματα συμβαίνουν, και δε μπορείς να κάνεις τίποτα, σωστά;		sentence-collector	1	5
e7768872c6490ff0e950b7f35d1ded0bf3100d06453f819f732ca44e2518f395	Τώρα είναι ζεστοί και ορεκτικοί οι τσίροι.		sentence-collector	1	5
e78b43a3da78c58a3edbede799dacc33abb08005aea97485ffb844ad9a1fb735	Ο πρωτομάστορης που δούλευε στο νερό κοντά		sentence-collector	1	5
e7a405851949b0eb4b384b74386ff004670d651b988edc2a48005a8f462ff4f1	Ποιο σκοπό;		sentence-collector	1	5
e7ac2209ebc9a9ab33a76ceea39da72b3acada727b0af6a24d3beac7a6378479	Στην άχαρη ζωή την ανεκπλήρωτη		sentence-collector	1	5
e7b1e0c806852043f3c9304b0c35c6e2581edbdece93e0c633987236d7801431	Κοιμήσου και συ, αρχοντόπουλο μου		sentence-collector	1	5
e7bc2c83feb16d170dfbbb5cc0e58868fd03de9220ac8e97142c0815e7c5e267	Αχ, παιδί μου!		sentence-collector	1	5
e7cdb113e6196736f93e6b278df9367c93d584e03ce8a0b5d7bcc4a13c6621cb	Το αγαπημένο μου φαγί!		sentence-collector	1	5
e7d4b6f29d00633023a7a5917c2e16af33fb299ea2f587c875ad4a3b6921b2be	Και γυρίζοντας στη Γνώση, που του χαμογελούσε χαρούμενη και ροδοκόκκινη, πρόσθεσε		sentence-collector	1	5
e7d53624d4006b296a12da47bbfa595ebc9e914bd423aa22e0235420c409125c	ήταν κοντός και χοντρός		sentence-collector	1	5
e7ddbdb5c224f8a6085534967e5230abb64b51421898546a61587cfa178f94a9	Και περνώντας σήμερα		sentence-collector	1	5
e812a5f53dc0dee25b72a2ab1bf0852b886b8640ef43e1e763a9e7d7c2eb316b	Το Βασιλόπουλο γύρευε να τους σταματήσει		sentence-collector	1	5
e8131c4861a7a1a7548d2f64e8cb14fb2a5fe755fd5521786d2d648f639a5fc9	Στην ταβέρνα, σαν όλους τους άλλους.		sentence-collector	1	5
e816e5aa0c4fbb823714be00c1e47bed475f664ebdb1dd3a56e990f243026f5a	Το ρεύμα παρέσυρε τις φελούκες		sentence-collector	1	5
e81ec0cd2fafb167c53a97707094a126cf744f71cf3a52c1963c17fa2a67b1af	Το Βασιλόπουλο γύρισε και τον κοίταξε στο πρόσωπο.		sentence-collector	1	5
e841c0702b31b7d8fcab6d043901fe9c8dcdb9f88be3f174f3e785e03284b32a	θέλω με τα μάτια μου να τα δω αυτά που λες.		sentence-collector	1	5
e84b2d822eeca64adcfc5cbed9169aa7b16fbf131ba3821efaf76b0e3032a5c4	Και ποιος θα πληρώσει τους δουλευτάδες;		sentence-collector	1	5
e872a149639b2fa806267f0c27535c7d150f1d1903aece08a5a71feb5812db16	Περπάτησαν κάμποσες ώρες.		sentence-collector	1	5
e87cd30fed461d0491ec76070fc633525ae441894572b88019255d8907494f77	Και με μεγαλόπρεπη κίνηση σήκωσε την περγαμηνή		sentence-collector	1	5
e8b7166c69ae72b212f4bf84177428298162018b0d8da8de5591747daca0a482	ο αρχικαγκελάριος με δυο υπασπιστές		sentence-collector	1	5
e8baec907f2454468074238efa15dd01c3ad17e27a63f302eb1728ad9d60663a	τον είδα, αποκρίθηκε ο υπασπιστής.		sentence-collector	1	5
e8bb226c3d8612e786a7082f3e8fc4da12af75e1e8e591b75274089a5ed3bd4b	όταν μια μέρα είδαν ένα νέο αγόρι με βαθιά ονειροφορτωμένα καστανά μάτια		sentence-collector	1	5
e8bef74e7222123c76d7e6f02900a79214fde8f9cc106de00e5c3f62f26342e7	Πικρό χαμόγελο είχε παγώσει τα χείλια του.		sentence-collector	1	5
e8bf2e325e957123d54424eefa954aabca08a41c188724d3352f910744ae9684	Ας τολμήσει να το ξαναπεί		sentence-collector	1	5
e8f5c2ec6ec7a67b4395e6ef416ae7cae50f31f025cea0124bfff1d81e156a1b	όπου ελπίζω		sentence-collector	1	5
e9179084f089f29aac67d583b8024d8947ce0ed7427c685aa2dd1a2f1ca2dcc0	Έλα δω να μάθεις το θαύμα.		sentence-collector	1	5
e926a00d3bea5cf309cea5eb8e27383c397427c5dfe31683a7d65d252df5ed70	Δεν έχω καιρό, αρχοντόπουλο μου, είπε.		sentence-collector	1	5
e92aefa598f97dadc880a9557d794c223681e4f94525045ce50e253888889ede	και σκορπίστηκαν γύρω τους		sentence-collector	1	5
e9381ac20b127a34f5f5fb942a68e90ad938a85e4d7111c17be7e590bcd1d0f7	είπε της αδελφής του.		sentence-collector	1	5
e944564a223d29ed75e44f7c76217980bbfbd90def0a717cc6915e8a0514451f	και κατεβάζω από το ποτάμι όλο το θεόρατο στόλο μου		sentence-collector	1	5
e96077e44ebab88cd2785b51e0c01674ea455de8b234fcf81eba361f0d7a8a5b	Εσύ όλο μεγιστάνες και βασιλιάδες ονειρεύεσαι		sentence-collector	1	5
e96c8b0e2876c586d8bd1fcb9b5e7c6b522388309a6dad7bc952152ddac4ad2a	Ποιος σκέπτεται θρόνο και βασιλεία!		sentence-collector	1	5
e97a8f51f851e51fc89a99ba3cad9a85e64f7ab7e45200107ceb65e9e67736d1	και τον γκρέμισε ύστερα από πάνω από το βουνό, για να μη μιλήσει.		sentence-collector	1	5
e99c987b2e511a2f139ae46a1734aa6a5cae3d6c334ffd0babc69aefa7d078b9	Μπήκαν μέσα και γύρισαν όλα τα δωμάτια.		sentence-collector	1	5
e9ba823ea29216a55ea1435b4dcd828a05074f4785db51249e1d0f333c8d3731	ρώτησε χαρούμενος.		sentence-collector	1	5
e9c92012a7b327d5f26d6ec5557a383642914c70d15a972f83d1583dcc9be3e0	μαύρες πια από τον καιρό και την υγρασία.		sentence-collector	1	5
e9ce9df90c02bb1d27529c68ae03d8fbcc7590ecc902eaea104e0e8e4a509a69	Μα δεν ακούστηκε απόκριση.		sentence-collector	1	5
e9dcabaa5b2fa2ec64c2a90d54899cabba1cf6ed79944155a887573de7f54020	περήφανα στολίστηκα το υπέρτατο		sentence-collector	1	5
e9e2a040a845521d22b9e026273fea0287024522002166d847a110dadbce40d1	ειδεμή θα έβρισκες άλλην εξήγηση να μας δώσεις.		sentence-collector	1	5
e9ee389c5900d60ea67fc1ca63dd6222d48761baaeca6f3fa1789c3f28fc52ba	Σε λίγο θα σας δώσω και βιβλία να διαβάζετε μοναχοί σας.		sentence-collector	1	5
ea06b316a0d5037b5df39df2a12e581753fb63ea344dae011ab3c2fdc0cae2ae	Όχι, αλλά για τα καστανά μάτια του γιου του.		sentence-collector	1	5
ea18270b7c18fdb6448197e3692ab3a02b418fb69bc48b50a3444251bfa116f6	Ας πούμε το άλφα είναι το πιο τυχερό		sentence-collector	1	5
ea25147ab2131da92c058e586d126fa5a24ff519e1bd711c0c7d8e2c9c984376	Θα πάω πίσω, Γνώση, και θα γυρίσω σε όλο το βασίλειο.		sentence-collector	1	5
ea27f748de953cc22c65dc4f62d03e1c40036031084bd09db86c6414a3abbfa0	Του κλέψανε, λέει, και τ' ωρολόγι του		sentence-collector	1	5
ea4c18c99531782c6227db91011e3a02cd6093f25a5cbadc757add42020cf2b2	Ο υπασπιστής υποκλίθηκε κι έκανε να φύγει.		sentence-collector	1	5
ea511c829604843f6a06adf6f0125cac32c104742f419ab149bcfcf940989a0d	ξέρει πως δεν πούλησες την αλυσίδα.		sentence-collector	1	5
ea5585f0461dccaa175e7aabd1630dae53278f77e16e497fc2b6501fce6b926e	Τι είναι πάλι οι φωνές;		sentence-collector	1	5
ea6179d9e8a6d1fbdf60f58a182b32d6c9415f1ed6aef2f183c205ba395c2f7e	να το βάλω εκεί που θα το βλέπομε όλοι		sentence-collector	1	5
ea6de4e41d5cdb188a9bcf5cc13433dad16e0e9b8a303774d28990d7570b5a98	Έφαγες;		sentence-collector	1	5
ea7f3439ba29e9bb17b9f65f47bbb6c7b912824e22880ca466ae9e14c2041550	και μαζεύοντας ό,τι καρπό έβρισκαν		sentence-collector	1	5
eaac3784cb46945d35486b4743221a49dc2c33c3de4e0f6217d49bdab32468eb	Πήδηξε το Βασιλόπουλο πίσω του		sentence-collector	1	5
eab31182e0216ee4ae1992fa77ec36ba46678123880e5237a98a268495abaa2c	Το μόνο που χρειαζόταν τώρα ήταν κι ένα σπασμένο δάκτυλο		sentence-collector	1	5
eab929d3704e60ea588bad658f4001e95d29a144e633c6020b6978842522eb86	Εμπρός σ' ένα ραγισμένο καθρέφτη κάθουνταν η Βασίλισσα Παλάβω.		sentence-collector	1	5
eabe95499ac69a7a39573626b0c7c4f291d9df9faf0a10881a493abb196d737b	Μα με τι;		sentence-collector	1	5
eac139f55ac76d32970887e51e4a9ccd992914e246c7a380cad1d2ac1a88b936	«Σχολείο του Κράτους»		sentence-collector	1	5
eac88754b59e8c275d4691e79d93335420789ee866a2d4503ce0d0a24d74f4db	Ούτε συ ούτε εγώ ούτε κανένας μας		sentence-collector	1	5
eadc92c49960e3081ae6396e932212bb55a51dc633d391ed92698dee64b9ab3f	το κυπρί καταγής		sentence-collector	1	5
eafc4d5c4984571559f51a88413d47b1f52837c4d6d83142b0d92cd2b0da9a76	Πήγε ίσια στο μαγειριό, με την ελπίδα να δει την Ειρηνούλα πρώτη.		sentence-collector	1	5
